<?xml version="1.0" encoding="UTF-8"?>
<!DOCTYPE DragonBall  SYSTEM "DragonBall.dtd">
<DragonBall>
    <personajes>
        <personaje nombre="SonGoku" fechaNacimiento="25/10/2003" vida="muerto"/> 
    </personajes>
    <habilidades>
        <habilidad nombre="SonGoku" habilidad="eer movimientos de rivales">58818</habilidad>
        <habilidad nombre="Vegeta" habilidad= "volar">
            <nombreHab/>
        </habilidad>
        <habilidad nombre="Inteligencia sobrehumana"></habilidad>
    </habilidades>
    <amigos>
        <amigo nombre="Son Goku" amigoCercano="Krilin"></amigo>
        <amigo nombre="Vegeta" amigoCercano="Trunks" ></amigo>
        <amigo nombre= "Bulma" amigoCercano="Vegeta"></amigo>
    </amigos>
</DragonBall>
